{
  "opendb_id": "82930319-ea0b-432d-8f46-865c7bd7d674",
  "connectivity_type": ["USB-C"],
  "polar_pattern": ["Omnidirectional"],
  "features": ["Mute Button"],
  "lighting": [],
  "metadata": {
    "name": "JOUNIVO USB Microphone",
    "manufacturer": "JOUNIVO",
    "part_numbers": ["JV-601"]
  },
  "general_product_information": {},
  "identifiers": {
    "version": 1,
    "identifiers": [
      {
        "type": "ean",
        "value": "0743815047845",
        "region": "all"
      },
      {
        "type": "mpn",
        "value": "JV-601",
        "region": "all"
      },
      {
        "type": "upc",
        "value": "743815047845",
        "region": "all"
      }
    ],
    "retailer_listings": [
      {
        "source": "amazon",
        "channel": "au",
        "source_product_id": "B07N2WRHMY",
        "pricing_enabled": true,
        "verified": true
      },
      {
        "source": "amazon",
        "channel": "be",
        "source_product_id": "B07N2WRHMY",
        "pricing_enabled": true,
        "verified": true
      },
      {
        "source": "amazon",
        "channel": "ca",
        "source_product_id": "B07N2WRHMY",
        "pricing_enabled": true,
        "verified": true
      },
      {
        "source": "amazon",
        "channel": "de",
        "source_product_id": "B07N2WRHMY",
        "pricing_enabled": true,
        "verified": true
      },
      {
        "source": "amazon",
        "channel": "es",
        "source_product_id": "B07N2WRHMY",
        "pricing_enabled": true,
        "verified": true
      },
      {
        "source": "amazon",
        "channel": "fr",
        "source_product_id": "B07N2WRHMY",
        "pricing_enabled": true,
        "verified": true
      },
      {
        "source": "amazon",
        "channel": "ie",
        "source_product_id": "B07N2WRHMY",
        "pricing_enabled": true,
        "verified": true
      },
      {
        "source": "amazon",
        "channel": "it",
        "source_product_id": "B07N2WRHMY",
        "pricing_enabled": true,
        "verified": true
      },
      {
        "source": "amazon",
        "channel": "jp",
        "source_product_id": "B07N2WRHMY",
        "pricing_enabled": true,
        "verified": true
      },
      {
        "source": "amazon",
        "channel": "nl",
        "source_product_id": "B07N2WRHMY",
        "pricing_enabled": true,
        "verified": true
      },
      {
        "source": "amazon",
        "channel": "pl",
        "source_product_id": "B07N2WRHMY",
        "pricing_enabled": true,
        "verified": true
      },
      {
        "source": "amazon",
        "channel": "se",
        "source_product_id": "B07N2WRHMY",
        "pricing_enabled": true,
        "verified": true
      },
      {
        "source": "amazon",
        "channel": "sg",
        "source_product_id": "B07N2WRHMY",
        "pricing_enabled": true,
        "verified": true
      },
      {
        "source": "amazon",
        "channel": "uk",
        "source_product_id": "B07N2WRHMY",
        "pricing_enabled": true,
        "verified": true
      },
      {
        "source": "amazon",
        "channel": "us",
        "source_product_id": "B07N2WRHMY",
        "pricing_enabled": true,
        "verified": true
      }
    ]
  }
}
